Nombre,Categoría,Precio,Disponible,Descripción,Tipo
There TV,Video,443.36,1,Add move ever window network.,Storable Product
Save Auriculares,Redes,715.8,1,Off light key.,Storable Product
Create TV,Accesorios,500.83,1,Husband available picture approach.,Storable Product
Church Teclado,Audio,818.63,1,Paper so difficult mission late kind.,Storable Product
Trade Cámara,Telefonía,863.22,1,Personal enough ball dream necessary.,Storable Product
Close Cámara,Redes,915.51,1,Allow explain executive teacher author.,Storable Product
East Cable,Accesorios,993.82,1,Boy different chance enter central arrive.,Storable Product
Structure Router,Audio,321.54,1,Buy read record wall matter management.,Storable Product
Be Mouse,Accesorios,954.72,1,Before while structure.,Storable Product
Parent TV,Redes,599.43,1,American series like prepare trouble consider one.,Storable Product
Prove TV,Computación,238.69,1,Fly bit claim in many production.,Storable Product
Institution Auriculares,Accesorios,503.92,1,Ten stay ability thank left approach.,Storable Product
National Router,Redes,837.09,1,Data near until.,Storable Product
Left Teclado,Video,815.67,1,Financial add impact different.,Storable Product
Thought Monitor,Audio,580.03,1,Usually factor relate indeed lot line lead.,Storable Product
Check Teclado,Audio,530.66,1,Everybody so increase various.,Storable Product
Movement Router,Computación,542.6,1,Oil process tend land machine forward several help.,Storable Product
Worker TV,Redes,1129.88,1,Him task improve fish list tree high.,Storable Product
Record Mouse,Video,513.72,1,Forward beyond suddenly between treat address century that.,Storable Product
Clear Router,Audio,136.74,1,Realize power system system teacher here first responsibility.,Storable Product
Song Auriculares,Computación,505.99,1,Piece TV young section its.,Storable Product
Billion TV,Audio,808.53,1,Animal someone fall.,Storable Product
House Router,Redes,934.59,1,Color bad that people.,Storable Product
Effect Teclado,Computación,802.24,1,Least project together let explain.,Storable Product
Office Laptop,Accesorios,967.81,1,Real lead few yourself table blood.,Storable Product
I Cámara,Telefonía,417.85,1,Ever not rate seat any paper.,Storable Product
Model Mouse,Audio,78.23,1,Pm per question return process.,Storable Product
This Cámara,Telefonía,1062.9,1,Small almost half capital travel.,Storable Product
General Teclado,Audio,348.33,1,Maybe evening clearly trial want whose far.,Storable Product
Truth TV,Computación,1030.73,1,Senior difficult put purpose.,Storable Product
Industry Cámara,Accesorios,824.19,1,Lawyer pull public once.,Storable Product
Test Monitor,Video,492.73,1,This no trip determine as statement travel few.,Storable Product
Issue Auriculares,Telefonía,458.19,1,Break doctor Mr home he we recent.,Storable Product
Now Cámara,Audio,257.12,1,Street past voice evidence.,Storable Product
Road TV,Video,580.51,1,Between rate name within grow huge.,Storable Product
Customer Cable,Redes,172.26,1,Politics others again skill during.,Storable Product
Car Smartphone,Telefonía,1083.36,1,Forget challenge too able teach.,Storable Product
Case Monitor,Accesorios,599.84,1,Address so draw food.,Storable Product
Contain TV,Accesorios,67.99,1,Second live sing message.,Storable Product
Boy Router,Accesorios,812.38,1,Feeling poor all your suggest international blue.,Storable Product
